{
  "schemaVersion": 1,
  "kind": "scenario",
  "id": "credential-after-long-input",
  "title": "Credential after a long prefix of benign text",
  "description": "The value appears after roughly 72 KB of benign text.",
  "semantics": "Scanners that window, chunk or truncate input must still find, or correctly ignore, values deep inside a large file.",
  "expectedOutcomeClass": "must-flag",
  "applicability": {
    "appliesTo": "any-family",
    "rationale": "Carrier-level."
  },
  "evidenceBasis": {
    "basis": "project-policy",
    "rationale": "The scenario states a project rule of the benchmark's design. Whether a particular value is, for its family, an instance of the rule is a per-fixture question: each fixture carries its own evidence (provider documentation, corroborating artifacts or project policy) in its fixture set.",
    "sources": [],
    "observedAt": "2026-09-29"
  },
  "lifecycle": "draft",
  "notes": "Project-authored by the Redact Secret project, which maintains this repository; not independent evidence. Draft; not yet reviewed."
}
